"Babycakes, аз съм с полу-паднал клепач, с к/мазна кожа, клепачът ми се омазнява и не задържа ни молив, ни сенки. Имам базата, но не съм доволна и е ""пенсионирана""- след 2-3 часа сенките са избледнели до неопределено сиво или изтрити, събрани на сгъвката. С нея и без нея, резултатът е еднакъв. Има телесен цвят и добре освежава цвета на клепачите, текстурата е кремообразна, моята ми е малко суха- може и това да е причината да не върши работа добре. В бурканче и трябва да бъркам с пръсти/ четка в него и винаги има опасност от замърсяване на повърхността. Иначе на нея сенките се нанасят леко, лесно и определено ги 'пигментира'.Бих ти препоръчала Photo Finish 24 Hour Shadow Primer на Смашбокс- с нея се родих и след 6-7 часа в затворено помещение с климатик, аз съм със сенки, без да са мръднали, все едно сега съм се гримирала. Няма събиране в сгъвката и цветовете се запазени свежи. some_url ",2.0
"Сплендора, мерси",0.0
"Splendora, благодаря ти!  Много ми беше полезно описанието ти, тъй като съм в търсене на подходящата за мен база.Непременно ще пробвам тази на Smashbox, още повече, че я има в trial размер, за да преценя дали ще ми пасне. Освен трайността обаче,за мен е важно да не пресушава прекалено,(както тези на UD например, които страшно ми изсушават контура, въпреки, че и моята кожа е комбинирана). Как се държи в този план?",0.0
"Babycakes, Смашбокският се ползва много пестеливо. Слага се много малко, колкото оризово зрънце за двата клепача. Изчаквам 30 сек. и нанасям сенките. Ако сложа повече, усещането не ми е приятно, нито нанасянето на сенки лесно- формулата е някаква полимерна и като изсъхне, кожата се усеща опъната и е много некомфортно. Не слагам коректор на клепача под базата, защото не се ""разбира с други"" под него, събира се, се нанася неравномерно. С Есте-лаудерския не съм имала проблеми да ползвам коректор под него или крем за очи. С мазен клепач съм и не съм усещала през деня изсушаване. Ползвам го редовно от половин година и не мога да кажа, че е повлиял негативно на кожата на клепача. Трикът е да се слага по много малко и пази сенките безупречно.",0.0
"Вчера получих 2 червила - pure color envy desirable и pure color envy shine mischievous rose и съм много очарована! //<![CDATA[pagespeed.dedupInlinedImages.inlineImg('pagespeed_img_q7jDFGPE2h1','pagespeed_img_q7jDFGPE2h4','pagespeed_script_5');//]]> Страхотна опаковка, цветовете са моите, макар че на мен ми седят почти еднакво на първо пробване. Единствено не знам от shine какво трябва да очаквам, не видях да е по- различно с нещо. Но все пак страхотно усещане е да държиш такова червило. //<![CDATA[pagespeed.dedupInlinedImages.inlineImg('pagespeed_img_q7jDFGPE2h1','pagespeed_img_q7jDFGPE2h6','pagespeed_script_7');//]]> Имам ANR, малки опаковки от revitalizing supreme и серията advanced time zone, но не знам дали не е повече за майка ми, едно червило pure color melon, което обаче не е за мен и ще го пусна за размяна, мостра на sumptuous bold volume mascara. Много доволна! //<![CDATA[pagespeed.dedupInlinedImages.inlineImg('pagespeed_img_q7jDFGPE2h1','pagespeed_img_q7jDFGPE2h8','pagespeed_script_9');//]]>",5.0
"Splendora , abs, честити придобивки! От къде поръчваш Estee? Аз поръчвам от uk сайта им до адрес на превозвач. Много добри оферти имат от време на време.Последно си взех този сет Скрит текст: Покажи за около 15 паунда. Червилото е страхотно и като цвят, и като консистенция - ще го купя и в пълен размер непременно.",5.0
"Мерси //<![CDATA[pagespeed.dedupInlinedImages.inlineImg('pagespeed_img_q7jDFGPE2h1','pagespeed_img_q7jDFGPE2h10','pagespeed_script_11');//]]> мъжът ми ходи до САЩ и аз поръчах до хотела му от американския сайт. Сегашната оферта с несесер с минита уцелих. Това са ми първите неща на ЕЛ и съм много доволна от покупките. //<![CDATA[pagespeed.dedupInlinedImages.inlineImg('pagespeed_img_q7jDFGPE2h1','pagespeed_img_q7jDFGPE2h12','pagespeed_script_13');//]]>",4.0
"Може ли някой използвал фон дьо тена Double Wear на Еstee да сподели мнение? Колко издържа,с каква покривност е,омазнява ли много,защото съм с мазна кожа...",0.0
Дай снимка на pure color melon,0.0
" Аз го ползвам от 2 години и съм много доволна ,много покривен и дълготраен,с нормална кожа съм и не мога да кажа дали е подходящ за мазна //<![CDATA[pagespeed.dedupInlinedImages.inlineImg('pagespeed_img_q7jDFGPE2h1','pagespeed_img_q7jDFGPE2h20','pagespeed_script_21');//]]>",5.0
"Потвърждавам, много покривен и много траен. Нося го твърде рядко, понеже не можеш да го свалиш с вода и измивен гел",4.0
"Направо е като маска Double Wear, бих го носила след пластична операция за прикриване на белези",5.0
"Е, стига де! Нося постоянно ДУ. Нанасям го с бюти блендър и въобще не стои като маска, ама въобще. И, освен това, нанесен по този начин, не е толкова покривен.Преди това го нанасях с четка (Сигма Ф80) и въобще не бях толкова доволна. Все ми се струваше, че си личи върху лицето.Сега, нямам вече такива проблеми и това е ФДТ, който не сменям.Да отговоря на въпроса по-горе - Да, подходящ е за мазна кожа. Не омазнява допълнително и е страшно траен. Но, все пак си зависи и от крема/основата под него.",5.0
"Подкрепям Мимита,не знам как нанасяте DW,но когато съм с него не си личи изобщо Аз също нанасям или с блендера или с пръсти.Последния път получих комплимент,че кожата ми е като стъкло Върху него бях с Метеоритите",5.0
"Мимита, шегувам се Но е факт, че не понасям толкова плътно покритие, а и слава богу не ми е нужно. Гримирали са ме няколко пъти с него и съм използвала една мини опаковчица за вечерен грим. Не и не.Ползвала съм го с четка, с пръсти с блендър все тая.Даже DW Light ми идва тежък.",2.0
"Аз от DW досега не съм открила подходящ светъл цвят, затова и никога не съм го купувала. Всички номера ми се струват тъмни, поне тези, които у нас се внасят.",0.0
"Странно, аз съм със светла кожа и има поне два, които са ми твърде светли...",0.0
"Много е възможно тестерите, които съм гледала, да не включват целия асортимент. Погледът ми към фон дьо тените на Ести не е много задълбочен; това, което бегло съм разглеждала, ми се с струвало твърде тъмно.За ориентация - много добре ми пасва Lancôme Teint Miracle - цвят 005 Beige Ivory. Ако Ести имат сходен нюанс, значи ще ми пасне.",0.0
"Светло с розов подтон? Ето какво намерих в нета Моят е Desert Beige и пак ми е малко светъл. Скрит текст: ПокажиНе е толкова розов, колкото изглежда тук обаче Имам и един по-тъмен уж за лятото, но не ми и хрумва да нося плътен грим тогава. Купих ги, вдъхновена от марката и от перфектния кавър ъп и ги зарязах, след като веднъж излязох от банята с ФДТ  Ако безупречната, шпаклована кожа с изрядно равен цвят, при това цял ден, ви е приоритет, препоръчвам.",3.0
"Аз също съм светла,но ползвам понякога DW 2w2 Rattan,добре ми е като цвят,но за през деня и на мен ми е прекалено покритието,за през деня съм на Шанел и Герлен.Как ви са ви впечатленията от тези два околоочни?-  ?Взех си тези три сетчета с околоочни,ето и този - АНР очният ми е доста лек,но другите два са разкошни Взех и този сет спирала  ,сега съм зарината със спирали,дано да са хубави,молива е двоен и много хубав-тъмно кафяв и черен Сега ще взема и другите грижи,харесаха ми от тест.А дали ще има намаления на козметиката за 14 февруари или 8 март ?Да почакам месец",5.0
"Revitalizing supreme e страхотен, другите не съм ги ползвала.",5.0
"OnDiNe_ , благодаря за ориентацията, като гледам, има светли цветове, но вероятно не съм ги видяла на тестери. Аз обаче съм свикнала с леко покривни фон дьо тени, този на Ланком, който ползвам, е такъв; може би силното покритие на Ести ще ми дойде в повече. Ще пробвам.",0.0
"Струва си да се изчака. Мин. год. в бутика на Есте и Клиник е имало %-ни намаления за 8 март (на 6-ти, 7-ми и 8-ми), твърде вероятно е и тази година да има. Както и за Свети Валентин...",0.0
"Момичета, някоя от вас ползвала ли е Estée Lauder Revitalizing Supreme за лице? Споделете мнения моля.Около очния от същата серия ми се отрази страхотно, ще го подновя със сигурност, но се чудя и за дневния.Дали е подходящ за смесен тип кожа?",0.0
"Тогава бях на 30 , със смесена кожа и беше огромна грешка-твърде обогатен е, резултатът бе тежък и мазен.",2.0
"Ползвам го за нощен сега зимният сезон,нормална към суха ми е кожата.",0.0
"danielad Скрит текст: ПокажиЦитат на: danielad в ср, 04 фев 2015, 08:42Аз също съм светла,но ползвам понякога  DW 2w2 Rattan,добре ми е като цвят,но за през деня и на мен ми е прекалено покритието,за през деня съм на Шанел и Герлен.Как ви са ви впечатленията от тези два околоочни?-  ?Взех си тези три  сетчета с околоочни,ето и този - АНР очният ми е доста лек,но другите два са разкошни Взех и този сет спирала  ,сега съм зарината със спирали,дано да са хубави,молива е двоен и много хубав-тъмно кафяв и черен Сега ще взема и другите грижи,харесаха ми от тест.А дали ще има намаления на козметиката за 14 февруари или 8 март ?Да почакам месец От къде си взе сета със спиралата? В магазина им в бг ги крият, а по други магазини след нова година всичко беше изчерпано(или по-скоро скрито)",0.0
"Сета със спиралата го взех от бутика в Мол София-66 лв,а днес сутринта поръчах още 2 от Енцо за по 53лв",0.0
"danielad, пробва ли серума Perfectionist CP+? Чудя му се от извество време.",0.0
"дългосрочно -не,само от мини И аз му се чудя Вместо АНР мисля да го ползвам ,въпреки че малко ми прилича като усещане на Идеалиста.",0.0
"АНР при мен не направи нищо, нито освежаване, нито ефект върху линийки. За Perfectionist четох хубави отзиви, а от мини как ти се вижда?Не по темата, но ползвам серума Genifique и ми е като кафе за кожата.",3.0
"Много добре,гладка като стъкло кожа Днес съм с него,очен и дневен Resilience Lift .Аз нямам кои знае какви проблеми,освен в околоочната зона и лицето каквото и да слагам не виждам кои знае каква промяна.Изхабих преди това една опаковка от новият серум на Диор-няма да повтарям обаче.Мисля ,че като дневна грижа Perfectionist ще ми е добре,а вечер АНР,заедно с околоочният серум АНР.Аз също имам една опаковка Genifique но ще почака",4.0
"Благодаря, ще го пробвам",0.0
"Аз се надявам за 8-ми Март да пуснат от Есте и Клиник едно - 20 или 30 %,миналата година много добре ми дойде.",0.0
"Аз чакам първо офертите за 14 февруари Но мисля,че няма да има кой знае какво намаление...най-много на парфюмите да направят",0.0
"Включвам се в тази тема,защото Ести е любимата ми марка за козметика.Ползвам два крема, серум, ВВ, СС и околоочен този  some_url  .От всичко съм доволна, от по-новите неща ми допада новата им серия Enlighten харесвам крема и ЕЕ крема.От гримиращите харесвам фондютена DW и имам и същия коректор.Ползвам някои неща и на Клиник, съчетанието от двете марки ми харесва като краен резултат.Аз също се надявам на намаления евентуално за 14.02 или 8.3.",5.0
"Дали знаете - има ли някакви промоции или намаление в момента в бутиците на Estee? И ако да, дали важат и за Clinique?",0.0
"Промоции няма,има продукти с подаръци-на ЕЛ новият парфюм ,ако вземеш 50 или 100 лв -подарък пътна чанта,няколко изостанали коледни сетове,на Клиник беше същото Няма и намаление.",0.0
Благодаря!,0.0
"Между другото ,има изгоден сет на серума на Клиник-на цената на серума-минита на кремовете заедно с чантичка Серума много го харесвам Нещо подобно беше сета",0.0
"Да, ако закупиш продукти на Клиник на стойност над 160 лв, получаваш комплект с 8 мини продукта в несесер:дневен + околоочен крем антиейдж, измиващ гел от 3-те стъпки, мини спирала, червен пастел за устни, мини пудра (или руж), парфюмче Aromatics Elixir, парфюмен лосион за тяло.Всичките неща, без пастела за устни, са в мини варианти.До изчерпване на количествата.",0.0
"Благодаря! Ама, че сте информирани, значи! Направо ви се възхищавам!",0.0
"Вчера казаха,че евентуално на ароматите ще има😯",0.0
"В Мол България ,в Дебенамс ,на шанда на Есте Лаудер и Клиник вече има -15% на всички парфюми,както и на всички останали марки аромати Има новият черен Опиум ,ако някой го желае Аз го харесах и утре ще го взема.коледният куфар на ЕЛ е намален на 150 лв,но е по-малкият вариант-без златният несесер,лака и парфюмчетата Има и останали коледни сетове с кремове,аз се заредих подобаващо",0.0
"Кой е този серум?Околоочния АНР и на мен не ми харесва, въпреки, че го ползвам за трети път. Просто купувам сетове, в които го има",2.0
"Само в Мол България ли има Debenhams?Имам смътен спомен,че и в Скай Сити Център и в Търговския център на ул. Коперник имаше такива магазини, или съм в грешка...?",0.0
"Никога не е имало. Да не бъркаш с Драка?Дебенамс е само в България Мол.Цитат на: Самсара в вт, 10 фев 2015, 19:26Цитат на: marigold_ в чт, 05 фев 2015, 15:21Не по темата, но ползвам серума Genifique и ми е като кафе за кожата.Кой е този серум?Lancome Genifique, вече има и нова версия, наречена Advanced. Хубав серум е, аз много го харесвам:",0.0
"Ах, на Ланком  Благодаря, Лу. Нали си говорим за Ести и аз се замислих  (малката е болна и аз не съм много в час)Аз съм го ползвала, старата версия на серума и не ми допадна. В момента ползвам серум с вит. С и колаген на Оле Хенриксен и съм много доволна. DW го харесвам много, но никога не мога да улуча цвета, нито аз нито консултантките. Последно бях с 2W1 Dawn и ми жълтееше.",0.0
"Tова им е кусурът на покривните ФДТ. Ако беше по-лек, все ще се нагоди...  Все пак си мисля, че има цветове DW за всички",0.0
"Аз си намерих цвят, който ми пасна идеално - избрах по картинки от нета, понеже цвета не се внася тук",5.0
Някой може ли да сподели мнение за базата за спирала? Хубава ли е? Сравнена с Максимайзъра на Диор?Благодаря,0.0
"Аз такова чудене му ударих за ББ крема дали да е light или medium и накрая се отказах, не знам ако трябваше да избирам фдт само по снимки какво щях да правя.",0.0
"С базата на Ести миглите стоят по-естествено отколкото с Максимайзера на Диор. На мен лично базата на Ести ми харесва повече, защото не се натрупва много, разресва миглите и стои по-леко. Ако някой търси драматичен обем, тогава би харесъл повече Максимайзера на Диор.",4.0
Много ти благодаря за отговора  Значи ще заложа на Ести този път,0.0
"От червилаат Pure Color Envy кои цветове не са за пропускане за светлите кожи? Искам да поръчам онлайн, а не съм ги виждала наживо.A тези дали са заредени при нас?  some_url ",0.0
"Аз имам Powerful и класическо- червеното, не ми е пред очите и му забравих името. Розовото стои много добре на светла кожа.",4.0
"Имам тези -Impulsive, Potent,Powerful със светла кожа съм.Имаше нови цветове заредени днес видях,но не обърнах внимание кои са цветовете,че пазарувах други неща.",0.0
"Не препоръчвам Потент да се поръчва без проба. Имам го, но никога не го ползвам самостоятелно, защото при мен стои много бледо розаво. Въпреки, че съм светла не се харесвам с него, а и текстурата му е по-различна от другите.",3.0
Определено.,0.0
+1  и аз поръчах от UK за 15 паунда. и двата продукта са страхотни,0.0
"Аз имам Desirable, а на сляпо бих поръчала и Impulsive, от новите имам Mischevous rose.",0.0
Благодаря за споделените мнения! Спрях се на Rebellious Rose и Eccentric ,0.0
Каква е редовната цена на 100 мл. Черна орхидея (ТФ)?,0.0
 244,0.0
Благодаря ,0.0
Момичета може ли да ми препоръчате светъл цвят на double wear на estee lauderче моя номер го спряха от произовдство fresco 01 2N2 бешеако някой се е сблъсквал с проблемаbouquet,0.0
"От 06.03 до 09.03 намаление 30% в бутиците на ЕЛ и предполагам в Дъглас,БЗ и т.н.",0.0
"Суупеер!  На всичко ли, трябва ли да се показва нещо?",0.0
Би трябвало да е на всичко и нищо да не се показва,0.0
