"Значи просто имаш нужда от по-богат крем. Аз много харесвам глобалния околоочен, но ти май не беше доволна от крема за лице от същата серия.Така че по-добре се насочи към друга марка за околоочна грижа. Ти всъщност сигурно вече си се насочила де",0.0
"Да, насочила съм се и съм супер доволна - на Benefit едни кремче  Изчезват тъмни кръгове на мига, светът на кожата се избистря, а няма някакви частици или пигменти, бори бръчици и т.н. Което не значи че няма да пробвам глобалния - кожата около очите е съвсем друга от тази на лицето и може да ми е добре",0.0
"Aredhel, погледни Idealist Cooling Eye illuminator- има керамичен накрайник, който охлажда кожата в околоочната зона, все едно изваждаш крема от хладилника. Разработен е за справяне с подпухвания (сутрешното), тъмни кръгове и фини линии. Богат е на дрениращи съставки, на такива които избистрят кожата. Леко пигментиран, като оптически дава отпочинал вид на кожата и може да се пропусне коректорът, ако няма сериозни проблеми в областта.",5.0
Виж и този  some_url ,0.0
"Здравейте !Отскоро следя темата и признавам си не съм чела много назад , така че се извинявам 😊За каква възраст е подходящ този комплект и каква му е цената ?Благодаря 😉",0.0
"Здравейте! И аз съм с питане - тази сутрин след измиване на лицето с Multi-Action Foam Cleanser/Purifying Mask нанесох Day Wear и по челото ми излязоха много ситни червени пъпчици. До момента не са минали, още ги виждам. Обикновено ползвам измиващото вечер, а сутрин ползвам едно друго на Авен за чувствителна кожа. Иначе крема си го ползвам всеки ден. Възможно ли е да е от продуктите на ЕЛ или да търся другаде причината, но не знам къде. Измих се, подсуших лицето с кърпа и после сложих крема.",0.0
"Аз го взех от Дъглас за 125лв. Това си е цената на крема всъщност ,а другото в кутията са подаръци.Така ми обясниха на мен.Относно възраст не мисля ,че има точно определена такава за ползване,а по скоро състоянието и нуждите на кожата са определящи. Лично аз съм 30+ и ми е добре,а като отзив за момента мога да кажа ,че никога до сега не съм имала по -мекичък и хидратиран контур.Крема си заслужава определено,но ако можете да пробвате предварително -пробвайте ,за да не се окаже неподходящ/Аз купих без проба ,но имах късмет -оказа се добър за мен продукт.",0.0
"Бих искала да попитам серумът ANR може ли да се използва самостоятелно или е задължително нанасянето на крем след него и подходящ ли е за нанасяне през деня или е хубаво само вечер да се нанася? Извинявам се за за питането, но за пръв път ще купувам продукт на ЕЛ , досега съм ползвала по-нисък клас козметика, но след като попаднах на тази тема и тази за Filorga, мисля да променя това. Кожата ми е суха, на 32 год. и мисля да пробвам първо с Estée Lauder Hydrationist и АNR серумът и кремчето за очи.",0.0
"elfea, ANR можеш да ползваш самостоятелно нощем, но ако решиш да го нанасяш сутрин след това задължително слагай крем.Лично аз съм го ползвала и сутрин и ми се е отразявал много добре. Като нощна грижа го ползвам самостоятелно.",3.0
"Aз пък нощем слагам повече грижа, защото има повече време да попие и да се усвои от кожата. Сутрин често слагам само от серума, защото е по-лек и попива мигновено, ако ще се гримирам.",0.0
"Излизаш само със серум под грима?О, аз сутрин няма как да изляза навън без крем.",0.0
"Да, зависи от типа кожа, за моята е по-добре така.",0.0
"Ти си знаеш Но серумът не съдържа защитните филтри на кремовете, нито SPF и не предпазва от вредните влияния на околната среда. Иначе и аз лятото примерно бих ходила без крем.",0.0
"Благодаря много за отговорите  ЕЛ Hydrationist го намерих в един сайт на 50% от цената му, но пък е Normal/Combination Skin и сега много се чудя . Моята кожа е суха, но пък цената му е много приемлива за мен.",0.0
"Здравей,Може ли да кажеш кой е сайта ?Предварително благодаря !",0.0
"Сайтът е този  some_url  Не съм поръчвала никога от него, затова и се чудя да рискувам ли",0.0
"Момичета, ако някоя е поръчвала от този сайт, моля да сподели мнение защото цената и на perfectionist за 50 мл. в момента е повече от прилична по-малко от 100 лв.",0.0
"Splendora, много ти благодаря ще го погледна! ",0.0
"Връщам се да похваля Double Wear All-day Glow BB като чудесна база под фон дьо тен. Когато го купих лятото, малко съжалих, защото ми е много лек като покритие, почти прозрачно. Хареса ми сиянието, ""немазно"" лъскавата кожа. И го зарязах. От няколко дена активно го употребявам като база под един лек фдт нa New CId Cosmetics, който също отлежава. Комбинацията от 2 много ми хареса- ДУ ББ-то добре изравнява тена на лицето, поскрива поричките, придава гладкост и сияние. Върху него фон дьо тенът се нанася лесно, доскрива пори и несъвършенства, няма ефект на маска, лицето гладко, свежо, сияйно, порцелан. Получава се средно, може и до по-плътно покритие, но без тежкия ефект, няма забиване в пори и линии. Усещах кожата мека, без лепкав финиш, без опъване или сухота- ББ-то е силно хидратиращо с хиал. киселина. Цял ден фдт не ми мръдна от лицето, не се ""разтопи"" в Т-зоната и не се наложи освежаване на грима.",5.0
"Здравейте красиви!Някоя от вас ползва ли този продукт?  Може ли отзиви   Че напоследък съм на вълна точно такива продукти и този е в списъка на следващите,които обмислям за покупка.Чудя се между него и Скрит текст: Покажипяната на Филорга,тази на натуралната козметика Мадара и евентуално една българска-то голямо чудене ,ама нали всеки луд с номера си",0.0
"Здравейте,вчера в нервен срив бях в Douglas...и от дума на дума, консултантката на EL ме покани на вължебния стол- почисти лицето ми с този продукт....не харесах останалата част от грижата /кремовете/ и свалихме всичко, отново с този продукт.Със светла кожа съм, чувствителна, с нарушен липиден баланс, НО този продукт не я подразни, напротив доста мек контур остави след себе си, а и аромата ме впечатли- свежест, енергия и чистота:) не купих него...но пък следващият път- тествах новия ФД, CC крема им, околоочни ANR /купих го/, пудрата- страхотна, храната им за очи също! И не на последно място се сдобих с подарък!",5.0
"Моля, някой използвал Advanced Night Repair Synchronized Recovery Complex II да ми опише каква е консистенцията , цвета, гъстотата на съдържанието му .Питам, защото мисля, ,че днес се сдобих с фалшив продукт.",0.0
"Околоочния ANR за каква възраст е подходящ ?Моя колежка на 41 г.ми каза, че не е подходящ за по-млади кожи, аз съм на 33 г. На нея са й казали да не го ползва и тя ми каза и аз да не го ползвам.",0.0
"Бих казала, че е течен, цвета му е на мед...ако сте пипи сиропа Мадал Бал- цвета е на вече разтворения:)Между другото- вчера ми поставиха такъв и не усетих да е толкова течен, но в комплекта който получих като подарък- се разлива в ръката...",0.0
"Не е особено течен според мен, само в сравнение с другите на Ести.",0.0
"Някой знае ли дали ще има някаква промоция за Очната линия? Видях, че има и комплект на цената на спиралите сега - спирала+ молив + подхранваща спирала. Цените в магазина на марката по-ниски ли са или са като douglas ?",0.0
"Хайде и аз в темата Не знам дали вие знаете, но през декември в Бюти Зона Дъглас може да се вземе колекция грим на Есте Лаудер само за 200 лв, която иначе струва 1000 лв (ако поотделно се закупят продуктите).Колекцията включва: 3 червила, 1 спирала, 1 молив за очи, палитра от 12 цвята сенки + 2 ружа, палитра от 3 гланца за устни, лосион за почистване на грим, крем за очи 7 мл, възстановяваща нощна грижа Advanced Night Repair в малък размер. Всичко това (общо 10 продукта) - в луксозно куфарче Видях и на живо колекцията, преди това разбрах за нея от списание Дъглас.Останах с впечатление,че не можеш ти да си избираш цветовете на червилата и сенките. Каквито са сложени в колекцията, такива можеш да вземеш.Според мен си заслужава. Да купиш за 200 лв луксозна козметика на стойност 1000 лв, си е направо подарък.(Даже не е 200, а 195 лв, тъй като в списанието имаше ваучер за 5 лв валиден за декември. Консултантката ми каза,че може да се ползва за всяка покупка над 100 лв, независимо дали е в промоция)",0.0
"Това е така наречения Коледен куфар на ЕЛ. Вчера беше с големи намаления и в Дъглас, и в Сефора.",0.0
Само 200 лв ли струваше или цената беше различна?,0.0
"Те са два- единия единия е с повече продукти и е 220 лв. май, а другия е 200 лв. Вчера бяха -25%, което е 150 лв. Аз обаче си имам миналогодишен и друг не ми трябва, затова не съм ги оглеждала подробно. Тази година куфарчето е много красиво и функционално.",0.0
"Някой смятал ли е продуктите? Вярно ли излиза 1000 лв под чертата? Че кое е толкова скъпо? Все пак за цената си звучи добре, на който са му необходими тези неща и му пасват цветовете.",0.0
"В каталога на Дъглас беше отбелязяно със ситен шрифт,че колекцията с грим е на стойност 1000 лв.В самата Бюти Зона консултанката потвърди,че закупени поотделно, нещата излизат около 1000 лв.Скрит текст: Покажи",0.0
"Някой ползвал ли е техните глосове?Как са спрямо Шанел и ИСЛ, примерно?",0.0
"Да аз, лепнеше ми и го подарих. Точно от Коледен куфар беше. Имам и още някакъв, но не съм голям фен. С Шанел не могат да се сравняват по никакви показатели.",2.0
"Не, глосовете не стават никак според моя вкус. Лепнат, размазват се извън устните (е, аз нямам навик да слагам молив, но това е друг въпрос ) Освен това забелязах бързо да ми се променя аромата - явно се развалят",1.0
Да вярно променят много бързо аромата.,2.0
"Аз имах един-два техни глоса и си ги използвах до края. Не се промени консистенцията или аромата, но си лепнат доста и за това не ги повторих.Доста по-назад са от Шанел в това отношение.",3.0
"Глосове не съм ползвала, но червилата са им уникални Говоря специално за Pure Color Long Lasting Lipstick",5.0
"А вие доволни ли сте от цените в бутиците на Estee Lauder в София? Аз си напазарувах преди няколко дни като имаше Черен Петък с 20% намаление, и днес като гледам цените въпреки намалението са с около 40-50% отгоре на ненамалените цени в сайтове като амазон, Boots, LookFantastic, и т.н. Дори в западноевропейските реални бутици цените са по-ниски въпреки по-високите наеми, разходи за персонал и данъци.Дори мостри или подаръчета не ми дадоха. Единствено дето бяха любезни, но това е нормално.Изводът, който си извадих, е да не скачам на намаление по-ниско от 40%.",0.0
Аз пазарувам главно от интернет. Сега ЕЛ се предлага вече и в feelunique Някой може ли да ми каже ориентировъчно каква е цената тук по магазините на червилата от серията Pure Color Envy?,0.0
62 лв,0.0
"Нали знаеш, че Estee Lauder във feelunique можеш да поръчаш само с превозвач?Не доставят директно до България марката.",0.0
"Скъпи са много цените в България и какво да направя? От нета специално ЕЛ не поръчвам, защото тук има подаръци и то големи при покупка над определена сума, а ползвам и карта.40% досега никога не съм виждала намаление в наш бутик, а съм им клиент вече повече от 10 години.ЕЛ е най-изгоден в Америка и когато приятели ходят, ако нещо трябва може да им се поръчва на тях.",0.0
Здравейте!Накой може ли да покаже как изглежда коледния куфар тази година и на каква цена е.Благодаря!,0.0
"Здравей,Знам само цената на Pure Color Long Lasting Lipstick - 54 лв., предполагам, че ще е около тази цена",0.0
"Благодяря Ви, във фийлюник цената е 24 паунда, което е 60лв. С код за отстъпка, пък макар и с превозвач, ми е по-изгодно отколкото от магазин в БГ. Не бих издребнявала за 6-7лв, дори и за 10, ама тук ме дразнят с отношението към клиента. Няма да изпадам в подробности, не е за това темата.",0.0
Аз купих червилото на ЕЛ за 62 лв. -толкова върви серията при нас,0.0
"62 лева са червилата от най-новата серия на ЕL.Мен точно с отношение ме спечелиха и съм готова да дам някой лев отгоре, но да си получавам несесерите с травъл размер продукти, както и безплатните грим сесии, по време на които обикновено също подаряват мини продукти, имам 3-4 спирали от там.Примерно в Енцо също има продукти на ЕL, ако човек търси изгодни цени, както и в e-bay.",0.0
"О, като ви чета отзивите за глосовете, хем се радвам, хем ме е яд. Радвам се, че не се увлякох да взема нещо, което ще разочарова и мен. Но наистина ме е яд, защото изглеждаха така хубави и след хубавите отзиви за червилата на ЕЛ, се надявах, че ще са толкова добри и глосовете им.",0.0
"Пробвай този саит, щом ползваш превозвач....мисля,че цените са по добри. some_url ",0.0
"Благодаря, Ave",0.0
"Имам нужда от малко насоки От декоративната козметика на Есте познавам само червилата и спиралите, обаче сега имам възможност да пазарувам всичко от марката с 40% отстъпка и ми се иска да взема руж и евентуално олиото с частици, което Денси препоръчва  Предпочитам ружа да не е кремообразен, така, че ще съм благодарна за насоки",0.0
"Имат ружове да, можеш да избереш желания цвят.",0.0
"siska79 завид,завид 40% отстъпка.. как?",0.0
Някой да изпробва вече продукти от серията Clear difference?,0.0
Веднъж годишно дават на преподавателите в един от брюкселските университети талони с 40% отстъпка и една приятелка ще ми пазарува,0.0
"Тъмно търсех темата за същия въпрос //<![CDATA[(function(){window.pagespeed=window.pagespeed||{};var a=window.pagespeed;function b(){}b.prototype.a=function(d,e,c){if(d=document.getElementById(d))if(e=document.getElementById(e))if(c=document.getElementById(c))e.src=d.getAttribute(""src""),c.parentNode.removeChild(c)};b.prototype.inlineImg=b.prototype.a;a.b=function(){a.dedupInlinedImages=new b};a.dedupInlinedImagesInit=a.b;})();pagespeed.dedupInlinedImagesInit();//]]>//<![CDATA[pagespeed.dedupInlinedImages.inlineImg('pagespeed_img_Ud-9hmHz321','pagespeed_img_Ud-9hmHz324','pagespeed_script_5');//]]>",0.0
"Някой знае ли откъде бих могла да закупя Estee Lauder Double Wear Stay-in-Place фон дьо тен? Цената му във Sephora е с поне 40% надценка от тази в американския сайт на марката, а няма доставка до България. Благодаря ви предварително! Знам, че има създадена тема за въпросната марка, но за жалост е заключена.",0.0
Има и английски сайт www.esteelauder.co.uk виж и какви са цените в www.enzo.bg,0.0
"---Благодаря ти! Видях английския сайт, но явно поради преобразуването на валутата пак се получава голяма надценка. А за enzo.bg - предполагам, че в краен случай ще трябва да го поръчам от там, макар че с доставката ще излезе почти колкото в Сефора.",0.0
"Ако не ти е спешно може да има около 20% отстъпка в бутиците на Ести около Коледа каквато имаше на 28 ноември, т.н. черен петък.",0.0
"Само за това не се бях сетила, мерси много!  Освен в Сердика център, знаеш ли къде другаде имат магазини в София?",0.0
Мол София и на Витошка.,0.0
"Аз си купих такъв фон дьо тен от feelunique.com. Цената му беше £29.50, но ползвах код за отстъпка и ми излезе £19.50, което е около 50лв + 2,20лв на Габко, че нямат директна доставка до БГ (не по принцип, а на тази и още някои марки). Колко струва тук?",0.0
78 лева,0.0
Не е ли 84 лв цената в бутиците на Estee?,0.0
"Може и грешката да е моя и да е 84 лева, но разликата от 6 лева не е от съществено значение, ако можеш да си вземеш от ФЮ с код за 50 лева.",0.0
Мъжът ми ще ходи в САЩ другия месец. Освен червило какво бих могла да си поръчам? Досега не съм пробвала нищо.,0.0
"Аз харесвам този крем:  some_url  друг не съм ползвала, но предполагам, че и те ще ми допаднат. Това също:  some_url  и фон дьо тена Double wear, ако има как да си избереш цвят.",0.0
