"Здравейте, моля за съвет. Взех си Day Wear Advanced Multy protecrion Anty Oxidant Cream заедно със серума ANR и New Dimension . Въпросът е какво да си взема за нощна грижа. Консултантката в Beauty Zone каза да нанасям крема и за през нощта... малко странно ми стана дневен крем да ползвам за нощен. На 31 съм- със смесен тип кожа без видими бръчки, изключвам околоочните. Също така ще се радвам и за препоръка за околоочен. В момента ползвам Yon- Ka",0.0
"Мисля,че най-добре да ползваш само сутрин Дейуеъра и евентуално отдолу АНР,а Ню Дайменшън вечерта като грижа пак отдолу с АНР. НД е по-скоро нощен продукт,който през деня задължително изисква(по препоръка) поне 25-30 фактор. А ти че си взела Дейуеъра още по-добре  Пробвай за очите серума и околоочния АНР. За мен са страхотно дуо,само обаче ако са двата заедно. По отделно някак си не е същото усещане.Дано съм ти била полезна! Ако и други се включат с препоръки ще е супер! И аз ще следя",0.0
"Нещо още по-нестандартно от мен - Дей Уеър го използвах за околоочен и такова чудо с никой друг крем не съм постигала - кожата ми се изпъна и избистри, фините линии изчезнаха, целият ми вид се подмлади. на лицето чак такъв ефект нямаше. Аз също си взех НюДайменшън, но не съм го пробвала още.",5.0
"OnDiNe_ , сподели после отзиви за New Dimension, че ми е любопитна цялата серия",0.0
"От къде купувате New Dimension, да не би да го има някъде на промоция, че и аз съм го загледала от известно време?",0.0
"В намалението на Дъглас и БЗ ще има един от серията,но аз лично не го познавам  some_url ",0.0
Имам само серума. Чакам да се избеля след хим.пилинг и го почвам.,0.0
Скоро приключвам Advanced Night Repair и си мисля да пробвам New Dimension. Някой ползвал ли е и двата продукта? Мисълта ми е дали да ги купя и двата или да заложа на New dimension за нощна грижа?,0.0
"Ооо супер идея,от утре сутрин и аз ще почна така с Дей Уеъра  Имам незапочнат НД,но като довърша Хидрашъниста го ''мятам'' и него като нощна грижа. Тъкмо докато се стопли и вземе да напича да съм го привършила,че да не заприличам на далматинец след глик.пилинг и НД. Добре,че има и 50 фактор любимото ми кремче,че иначе-лошо... А ти как ми ''пусна мухата'' за Трипъл крем маската... Сега и нея да я мисля плюс новата Триминутна детокс на ЕЛ Пепина,поне от проба установих,че НД може и да е недостатъчен самостоятелно за по-сухи кожи,аз съм с комбинирана и ми беше предостатъчен за вечер. Добре си го замислила като комбинация АНР и НД,на мен даже така ми го препоръчаха",0.0
"Момичета, ето едно изгодно предложение на серума Perfectionist some_url ",0.0
Някой пробвал ли е Resilience Lift околоочния крем? Интересува ме попива ли добре и има ли усещане за опъване в тази област?,0.0
"lili_78 ,Аз съм го ползвала. При мен нямаше усещане за опъване, попиваше почти веднага. Но аз съм на 49 г. Възможно е и кожата ми да го ""изпива"" по-бързо.Иначе от същата серия ползвах дневния и нощния крем. Не видях особен ефект, вероятно за мен трябва нещо по-сериозно, което да работи в посока - стягане на контура, плътност...",3.0
В тези куфарчета - червените продуктите имат ли срок на годност? Дали са стари продуктите?,0.0
"Взех си мостри на крем Resilience Lift и серум Perfectionist (CP+R). Кожата става нежна и гладка, но съм с усещането, че това се дължи на някакъв силиконов филм.",4.0
"И аз мисля, че в Perfectionist има силикони, но много добре се отразява на лицето ми, изглажда страхотно, не стои мазно. Вече втора опаковка започвам.",5.0
"На мен ми е мега силиконов, никак не ми се отразява добре на младата, мазнееща кожа. Но съм виждала как шпаклова при по-възрастни и как засияват.",2.0
" Много точно описание:Цитат на: OnDiNe_ в пн, 21 мар 2016, 22:44...как шпаклова при по-възрастни и как засияват.А за куфарчетата - не мисля, че са стари продуктите вътре. Тези, които ползвате вече New Dimension от известно време, дайте малко отзиви.",0.0
"Аз...Спрях по преди известно време, понеже бях започнала изцяло нови продукти, но ми излязоха пъпки и ги спрях превантивно всички. Смятам, че проблемът не беше в ND. И не знам дали си въобразявам, но за малкото време, в което го ползвах, сякаш видях ефект. Не че имам отпуснат контур, но скулите ми станаха още по-изразени, изобщо сякаш всичко се стегна. Но може да се държи на отслабване или нещо друго...Интересно ми е какво ще кажат другите?",4.0
"Хаха, то и аз се шпакловах с Perfectionist-а. Изглеждам добре, ама всъщност не искам ефект на грим, а някакво дългосрочно положително въздействие върху лицето ми. Т.е. след като спра да го ползвам, да изглеждам по-добре от преди да започна.",0.0
Аз отдавна не вярвам на такива чудеса...,0.0
"Здравейте,някой поръчвал ли е скоро от официалния сайт? От там ли излиза най-изгодно да се купят продуктите? Впечатления за новия почистващ продукт имате ли? Благодаря!",0.0
"Аз преди 2 месеца се опитах да поръчам един сет, който беше на много добра цена. Имаше си го наличен в сайта, пуснах поръчка, но до 10-тия ден нищо не се случи с тази поръчка. След това я отказаха без изобщо да получа каквото и да било уведомление. Попитах ги на Live chat, казаха че е изчерпан. Не знам тогава защо седеше като наличен още много време след това. Големи разправии имахме. Два пъти им напомнях да ми върнат парите, върнаха ги чак на 15-тия ден след отказа.Не бих пробвала отново - излишни нерви и загуба на време.",1.0
"Американския сайт ли имаш предвид? Не мисля, че е много изгодно.",0.0
"Не, UK сайта.",0.0
От днес започва промоцията на Estée Lauder & Clinique:- 20% намаление при покупка на 1 продукт грижа за кожата;- 30% намаление при покупка на 2 продукта грижа за кожата;- 40% намаление при покупка на 3 продукта грижа за кожата.,0.0
"Серията Daywear EL добре ли е за млада кожа? Бих искала да се възползвам от намалението и фдт като не влиза в него, поне някой крем да взема  Приемам предложения,",0.0
Аз много харесвам Daywear. Ползвах крема няколко пъти под 30тата си годишнина и бях много доволна.,5.0
"Аз съм на 30 и в момента ползвам Daywear с фактор 25 за дневна грижа и вчера си купих Nightwear за нощна грижа.Общо взето съм доволна. Някаква кой знае каква разлика във вида на лицето си не наблюдавам...  Харесва ми, че е с 25 фактор, но не ми допада, че не ми е достатъчно лек - трудно ми попива. Кожата ми е склонна към омазняване, но пък е и с дехидратирани зони, които общо взето се заличиха с използването на крема.",3.0
"И на мен Daywear ми идва тежък, а уж е oil free, другите версии на крема са ми съвсем мазни. Затова го ползвам само вкъщи. За навън, когато ще слагам и грим, правя друга схема: серум Идеалист, след което Екрана на Кларанс: хем факторът е по-висок (новият екран с 50 фактор), хем нито един от двата продукта не е мазен. Особено за лятото тази комбинация при мен е най-успешна: серум на Ести плюс Екран.",0.0
"Аглая, все се засилвам да си избера серум и да го ползвам вместо крем и все не се решавам. Ти доволна ли си от Идеалист? Наблюдаваш ли промяна в кожата?",0.0
"Да, доволна съм. Обаче за промяна не мога да говоря, защото със серум плюс екран съм от години, може би 3-4, поради което търся запазване на ефекта, предотвратяване на бръчки, на прекомерно омазняване и пр. Кожата ми е мазна, особено лятото, така че тази комбинация ми идва добре. Само Идеалист ми идва малко (предполагам, че би стигнал само в тийнейджърска възраст), той леко матира и изглажда. С Екрана отгоре идва усещането за намазване с крем, повече хидратация, а и слънцезащита. Така че е добре да се ползват и двата продукта.Комбинацията е идеална основа за грим и за поводи, в който кожата не е добре да ""лъсва""; с нея съм, да кажем, 4-5 дни в седмицата, но през някои от дните си ползвам и крем; опитвам се да разнообразявам. Все пак забелязвам, че все към серуми посягам, включително и вместо нощен крем сега ползвам един серум на Герлен, който хидратира по-добре от кремовете. Ползвам и Визионер на Ланком отново вечер. Ти от какво точно се притесняваш по отношение на Идеалиста? Че ще ти пресуши? Няма такава опасност, ако се ползва заедно с Екран. Последният може да се дозира. Аз ползвам само три капки (той е течен): на челото и на бузите. Ти може да сложиш повече, да го докараш и до ефекта на крем, ако искаш. Просто Идеалистът ще махне прекомерното омазняване.",4.0
"Благодаря за споделеното. Колебаех се между Daywear и Clear difference, заложих на втория за лятото. Следващата ми покупка ще са екрана(чудих му се доста, но все ме спираше нещо) и Идеалиста, благодаря Аглая, вече ще ги пробвам.",0.0
"Clear difference не съм пробвала; иска ми се да опитвам серума и пак да го комбинирам с екрана, подозирам, че ще ми хареса.Много съм доволна и от Estée Lauder Idealist Even Skintone Illuminator; в момента ми се свърши класическият идеалист и ползвам този: той по-малко матира, повече озарява и хидратира - чудно се съчетава с екрана отново; дори още повече ми харесва от стандартния идеалист тъкмо заради по-доброто овлажняване. Обаче ми се струва, че са го спрели от производство; все по-малко го намирам, а в бутиците не го виждам.",5.0
"Екрана, който обсъждате в момента е в намаление в Бюти зоун. Върти ми се цена 60 и нещо. Да не ви подведа, защото водех приятелка да купува Найт Рипеър на ЕЛ с 20% в момента в Бютито, та само маркирах периферно, че има намаления.",0.0
"И аз имам същите впечатления от Daywear и едвам изхабих една опаковка. Ползвам и точно същата комбинация сега за през деня като понякога вместо екрана слагам биодерма аквафлуид неоцветения.Притеснявах се само да не ми е малко хидратацията и слагам едно леко серумче на Регал под Идеалиста. Аглая, какво полчваш около очи за през деня?Чудя се сега за Doublewear light. Искам нещо съвсем леко за грим през деня, но да не е пудра. Съвсем натурален финиш. За сега ползвам микс от матиращия праймър на ЕЛ и Туш Екла, но праймърът свършва а искам един продукт да ползвам само.",0.0
"gevestra, за очите съм консервативна - и денем, и нощем само Веледа. Имат два крема - с шипка (за млада кожа) и с нар (за зряла); и от двата съм доволна като в последно време залагам на втория. Пробвала съм много други кремове, включително и на Ести, но с Веледа ми е по-добре: подхранва повече, хидратира, нямам никакви бръчки. Като слагам Екрана на цялото лице, леко минавам и около очите, колкото да има някаква слънцезащита; но преди това - Веледа.",0.0
"На мен също Daywear ми идваше тежък и мазен, допълнително засилваше отделянето на себум от комбинираната ми кожа, поради което го изхабих като нощен крем.Аглая Епанчина, аз съм пробвала серума Clear difference и бях доволна.По принцип всекидневната му употреба води до пресушаване, затова трябва да се ползва при нужда.Колкото до крема Clear difference, който излезе миналата година, аз имах малка проба, ползвах я.За мен този крем и като текстура, и като действие, наподобява на Клиник dramatically different moisturizing gel.",3.0
"Някоя от вас да е ползвала New Dimension? Заглажда ли фини линии?В момента съм с Revitalizing Supreme крема и съ ного доволна, има ефект върху линийки и сякаш стяга кожата.",4.0
"Пробвах преди два дни точно мостра от този крем Supreme +, харесва ми, но се колебая че имам неуспешни покупки с кремовете за лице. Кога го ползвате, за 40+ става ли?",0.0
"Supreme за лице ми е един от любимите кремове. На 40+ съм. Е, не съм се подмладила с него, но кожата изглежда една идея по-свежа и загладена.И Daywear ми е един от любимите хидратанти.На New Dimension имам само мостри, но още не съм ги пробвала.",5.0
"Момичета, има много изгодно оферта в английския сайт на Ести - серума Ню Дименшън 30 мл, контуриращата палитра за лице и 15 мл маска за лице за 40 паунда. Останали са само 4 бройки. some_url ",0.0
"Сайта на Ести не винаги се обновява навреме. Два пъти поръчвах неща в промоция, които бяха налични и после никой не ме уведоми, че са ми отказали поръчката, а аз трябваше неколкократно да проверявам, дали е отказана и какво се случва. Не ми върнаха и парите, а трябваше повече от 20 дни да се разправям с тях, да ме препращат към различни отдели - live chat,технически отдел, да пиша на различни е-мейли, докато ми върнат парите. Изключително разочароващо,некомпетентно отношение и пълна загуба на време. Жалко, защото много харесвам козметиката. Вече всичко тяхно си купувам от реален магазин.",3.0
Съжалявам да го чуя. Аз пазарувам от там и никога не съм имала проблеми. Включително и сега поръчах 2 броя и веднага се актуализира наличната бройка.,0.0
"Аз също имах голямо желание да пазарувам, защото имат наистина добри промоции, но от 2 поръчки и с двете имах проблем, което си е 100% неуспех и е достатъчно, за да ме загубят като клиент. Възможно е и късметът да ми е бил такъв, но един път е случайност, втория вече говори за политика на сайта",0.0
Абсолютно си права.,0.0
"Аз също неколкократно съм поръчвала от сайта на Есте, никога не съм имала проблеми.",0.0
"Здравейте, може ли малко повече информация за поръчките от сайта? Трябва ли кредитна карта и колко излиза доставката? В пощата ли пристига? Благодаря!",0.0
"Аз поръчах скоро, доставката беше безплатна до адрес в УК (ползвам превозвач). Платих с кредитна карта.",0.0
Какъв превозвач ползваш? Може ли линк?,0.0
Заповядай: some_url ,0.0
"Това е новият куфар на Есте Лаудер. В Бюти Зоните и бутиците на Есте вече го има Куфарите,които се предлагат в парфюмериите и в бутика, се различават...",0.0
Каква е разликата между този в Дъглас/БЗ и в бутиците?В Бургас си нямаме бутик... А цената му каква е?,0.0
"Куфара в бутика има 2 гланца + още някои екстри повече и е по-голям от куфара в Дъглас и Бюти Зоните.Цената на куфара в Дъглас е 239 лв, а в бутика - 245 лв.",0.0
"Благодаря!А този на сайта им, който е и този на твоята снимка, кой от двата е?",0.0
От бутика е.На другия не успях да открия снимки в нета.,0.0
"Здравейте, искам да си купя Ревиталайзер сюприм +, в парфюмерията на местния мол, продават крема за 198 лв.за 50 мл, също го продават в подаръчен комплект с два малки серума и почистващ продукт, пак на същата цена! Нямаха мостри и за това,ако някой го е ползвал, моля да сподели? Също искам да попитам, такава ли му е цената и къде в България мога да го намеря по изгодно и как ви се струва комплекта, заслужава ли си? Благодаря!",0.0
"На предишната страница го обсъждахме, а сигурно и преди в темите. Погледни назад. Хубав е кремът, взимай го.  По-изгодно ще ти е в подаръчен комплект, но за цена дали е добре, не мога да помогна. Имай предвид, че не е съвсем лек крем. Прецени си нуждите на кожата. Затова най-добре е с мостри, но защо не ви дават? Ако нямат пакетирани, могат да ви отсипят в малко контейнерче. Нямат право да отказват.Аз искам да пробвам и този за около очи от същата серия, но още не съм си поискала мостри и нямам впечатления.Допълвам се: сега видях, че ти питаш за +, не съм обърнала внимание. Предполагам, че ще е също толкова добър. Който е ползвал и двата, нека да сподели.",4.0
"В края на месеца ще има черен петък във всички Молове и ще можеш да вземеш крема с отстъпка, включително и в подаръчен комплект Един от най добрите продукти на Есте Лаудер е.",0.0
