"Коментарна тема за марката и нейните продуктите.Моля, кажете кой е вашия/вашите любими продукти от бялата козметика на Estee Lauder!старата тема.Компанията Estee Lauder, която днес наследниците на великата Жосефина Естер или Ести, управляват повече от успешно, в момента има в портфолиото си дълъг списък от козметични марки под своето покровителство, сред които Clinique, Aramis, M.A.C, Lab series, La mer, Bobbi Brown, Donna Karan, Tom Ford, Tommy Hilfiger и др.",0.0
Най-любимия ми продукт на ЕЛ е серум ANR,5.0
"Благодаря за темата, Денси Аз не съм пробвала бяла козметика на ЕЛ, но смятам да поправя тази грешка със серума АНР Набелязала съм и крем от серията Resilience Lift , ако някоя от вас е ползвала, ще се радвам да сподели.",0.0
"От това, което съм ползвала от бялата козметика и на мен АNR ми е фаворит.Смятам да си купя сега II.",5.0
"Благодаря за темата! Аз не съм ползвала, но мисля да си подаря скоро един ANR, така за проба, но може би ще е от 30мл., че да не рискувам много. И освен това ми е интересно да чета темата, така че с удоволствие се записвам.",0.0
Не си представям и ден Без серума Advance Night Repair.,5.0
+ resiliance lift околоочния,5.0
Моят най-любим продукт е Idealist А от декоративната козметика - новите червила Pure Color Envy Sculpting Lipstick.,5.0
"И моят,серумът за порите.Advance Night Repair серума също много го харесвам.",5.0
"Ами да се включа с нещо съвсем различно - ANR.  Първият вариант на серума.Надявам се скоро всички да сме така очаровани от нещо ново, имам предположения с един продукт, да видим   Благодаря на Денси за темата",5.0
И аз от години ползвам Idealist- без него не мога.,5.0
"Аз с Идеалиста не се разбрах - дори не разбрах какво действие има върху кожата ми - озарява ли и действа само визуално, или всъщност помага за изравняване на тена на кожата. Използвала съм две и повече не бих. Явно не е моят продукт.А Ести ми е любима, много любима марка Бъбъл, моля те, кажи повече за серума за порите.",4.0
"Благодаря за новата тема!Много харесвам Идеалист: направо не мога без него; като ми привършат серумите на други брандове, ще си взема Advance Night Repair: ползвала съм много мостри от него и съм доволна. За сметка на това започвам сериозно да се отдръпвам от Клиник. Преди си ползвах с удоволствие Супердифенс, но новата му формула ми идва тежка. Така че, като дойде време да си купя нов дневен крем, май ще е на Ести.",5.0
"Благодаря за новата тема! На ЕЛ от бялата козметика съм най-доволна от Idealist. При мен визуално заглажда лицето и свива порите.От декоративната козметика имам две от новите червила, които харесвам и ползвам често. Скоро взех и спирала за обем, но още нямам категорични впечатления.",4.0
"Харесвам измиващите продукти на Ести, от кремовете - не успях да намеря подходящ за мен. Спиралите им също не са ми фаворит, бих искала да пробвам тяхно червило.",3.0
"Само на мен ли идеалистите ми оставят златист, непопит слой на лицето?",1.0
"Знам, че Idealist Even Skin Tone Illuminator оставя озаряващ златисто-перлен филм на лицето. От марката ползвам доста неща: DW BB Glow cream, DW Brush-on pen ( тази писалка е уникална в освежаването на зачервени и уморени очи, след дълга работа на компютър, скрива добре тъмните кръгове), сенки, моливи за очи и вежди, основа за спирала и спиралата Sumptuous Extreme, крем за лице и очи, лосион, измиващи продукти (Perfectly Clean Foam cleanser/ Purifying mask Perfectly Clean cream cleamser/ moisture mask). Червилата Envy са ми любими: имам в Red Ego Tumultuous Pink, скоро смятам да се сдобия с Envious. Хвърлила съм око на новите палитри сенки Envy- разкошни са, пигментирани, мажат се като масло, нанасят се леко и равномерно, ползват се и с мокри, и сухи четки. Имам Perfecting Loose Powder, но в сравнение с пудрата ми на Caron, всички пудри ми бледнеят.OnDiNe, аз имам Микро есенцията, но съм я зарязала, заради златния лосион. За 2-3 седмици ползване не мога да кажа да има кой знае какъв ефект- всичко е комплексно и само от един лосион нещата не зависят драматично. Но ми харесва много повече от тониците, кожата ми се чувства добре, освежена и комфортна. Усещам слаб, едва доловим аромат. Текстурата е особена- не е бистра водичка, а леко желифицирана, оставя много лек, немазен филм на лицето, с което нанасянето на следващия продукт е по-лесно и икономично. Целта му е да омекоти кожата, да улесни проникването на съставките на следващия продукт, да даде начална фаза на хидратация- т.е. действа като основа за серума или крема. Има хиалуронова киселина, има съставки за бистър и равен тен, противостареещи съставки, има мая- същата съставка като в АНР. Няма алкохол, не съм имала зачервявания, пресушаване. ЕЛ съветват да се използва след тоник и преди серума. Аз го ползвам без тоник. МЕ е лансирана на азиатския пазар преди 2 години, ако не се лъжа, където стъпките в грижата на кожата са много повече от тези на европейките. Не го ползвам с тампони за лице- не ми се хаби продукт по тампони. Изливам малко количество в ръцете и нанасям с ръце. Текстурата позволява масаж.",5.0
"Много са им хубави новите червила, много! Просто разкош за устните! И цветове имат хората.Страшен фен съм и на пудрата Бронз Годес. Харесвам и сенките им, както и черния молив за очи.Привличат ме всяка Коледа празничните им най-големи куфари.Иначе Идеалитите и разбира се безспорния фаворит на темата AHR",5.0
"Оооо, Бронзовата богиня я обожавам, особено олиото за тяло с блeстящи частици",5.0
"И олио, и пудра, и парфюм, и всичко излязло под това име.",5.0
" Не, и при мен така се получава.",1.0
"Сплендора, много ти благодаря за отзива, отдавна чаках някой да пише по въпроса!  МЕ го пробвах на летището в Истанбул преди много време и бях очарована, защото ефектът беше също като първоначалния от първия ми АНР - преобразена кожа. Сега вече го няма това УАУ. Тук по магазините още го няма, така че няма как да си взема проба, за да видя дали ще има пак същия ефект или не си заслужава поредния скъп продукт за лице.",5.0
"Пуснаха го на някои места в Европа, но е малко трудно да научиш европейката да наслагва продукти и да увеличи броя на стъпките, както в Азия. В Европа все още битува мнението, че не е хубаво да нанасяш много продукти и се чака един продукт да прави всичко. А в Китай, Корея, Япония (за които пазари беше създадена формулата на МЕ) такива стъпки като праймър за серума/ крема, есенция, скин финиш са неделима част от ритуала. Ако трябва да избирам между тоник (да речем Perfectly Clean toner) и този лосион, веднага бих си взела лосиона. Наистина има разлика сравнен с тоници. МЕ помогна на кожата ми да живне след августовските горещини и наистина видях разлика още първата седмица- тургорът се подобри, по-мека кожа и свеж тен при нанасяне, посвиха се порите, по-малко крем нанасям.",0.0
Идвам с въпросче (нямам възможност да прегледам темите): Марката има ли продукт с ефект минимизиране на порите за мазна или смесена кожа? ,0.0
" Да,ето този,много добър продукт според мен: some_url ",4.0
Много ти благодаря мила! ,0.0
"Сплендора, мисля да си го поръчам ""на сляпо"" от официалния сайт   Виждам смисъл от него.",0.0
Някакви мнения за серията Daywear?,0.0
"Ползвала съм дневния крем за комбинирана кожа DayWear - приятен без да е нещо особено. Идваше ми една идея тежък като консистенция, просто попиваше по-бавно. И точно заради това не бих повторила.",3.0
Някой би ли могъл да сподели мнение за ВВ кремовете и хидратиращите дневни кремове за нормална кожа?,0.0
Day wear е хубав и Hydrationist.Даже втория ми допада една идея повече.,4.0
"На мен Hydrationist ми допадна повече от DayWear, но пък няма фактор",4.0
"И на мен DayWear ми е мазен. Обаче има един - oil free, SPF 25. Чудя се той дали е по-лек, някой пробвал ли го е?",2.0
Здравейте. Можете ли да ме ориентирате долу-горе кой цвят от DW Stay in Place отговаря на Intensity 3 от DW light. Благодаря! ,0.0
"Аглая, тествала съм емуслията на ръка- почти веднага попива и изчезва, докато кремът за н/ к кожа оставя филм. Но не знам да е матиращ, просто е обезмаслена и силно олекотена формула за мазна кожа.",3.0
"Благодаря ти, Splendora, по-добре ще е за мен, ако не е матиращ (за да го няма евентуалното ронене, характерно за подобни продукти), а да е просто нетежък крем. За съжаление винаги, когато съм искала мостра от него, все са нямали; подозирам, че не е нарочно, защото са ми предоставяли мостри на други продукти. Та, все нямам късмет да го пробвам. Търся заместител на Супердифенс, чиято нова формула не ми харесва. Затова съм се насочила към този крем на Ести и най-вероятно ще го купя.Друго на бранда, което ми харесва:Perfectly Clean - любим ексфолиант, с много дребни и ефективни частици.Hidra Complete Mask - дава чудесна хидратация, много любима маска.Resilience Lift Extrime Mask - ефектът не е така мигновен, като от хидратиращата маска. Но усетих ползите, когато използвах продукта вместо нощен крем, без отмиване; на сутринта се събудих с преобразена кожа.",5.0
"Цитат на: Аглая Епанчина в вт, 14 окт 2014, 17:39Perfectly Clean - любим ексфолиант, с много дребни и ефективни частици.Hidra Complete Mask - дава чудесна хидратация, много любима маска.Resilience Lift Extrime Mask - ефектът не е така мигновен, като от хидратиращата маска. Но усетих ползите, когато използвах продукта вместо нощен крем, без отмиване; на сутринта се събудих с преобразена кожа.Ако не се лъжа, ексфолиантите ги спират. Хареса ми много балансиращия за н/к кожа- свива и отпушва порите, все едно съм била на почистване на лице в салон, отстранява мъртвите клетки и сухите люспички, кожата е добре освежена, с равен тен и гладка. Пробвах и този за мазна кожа- може да се ползва като маска са лице и при отмиване се ексфолира кожата. И на мен ми допада хидратиращата маска- оставя кожата много гладка и освежена. Пробвах и да спя с нея, като преди това нанесох серум.",5.0
"Splendora , би ли дала линк към балансиращия крем, от същата серия Resilience lift ли е?",0.0
"Biskvitka, имах предвид ексфолиантите. some_url ",0.0
" вчера го поръчах, 150 мл ще ми стигнат за вечни времена, заедно с останалите ми продукти. Дано остана доволна и си заслужава.",0.0
"Здравей,В момента го ползвам вече за трети път и е ок за нормална към мазна кожа, по-лека е текстурата",4.0
Благодаря! Значи може би това ще е следващият ми крем.,0.0
"Splendora, благодаря ти  Този ексфолиант ми е любим, а съм се заблудила, че коментираш кремове - може би, защото съм в издирване на такъв, който да освежава тена, да има анти-ейдж ефект и да е 35+",5.0
"Moмичета, отзиви за спиралата на Estee Lauder Sumptuous Infinite Daring Length + Volume Mascara?",0.0
"Аз съм с нея сега, писала съм надълго и нашироко в предната тема за спиралите (за нея и за още две), взех си я някъде в края на август",0.0
"OnDiNe_ , благодаря Отивам да чета",0.0
"Biskvitka, вземи си пробичка на Revitilizing Supreme- това е глобален анти-ейджинг продукт, хидратант, превенция, корекция, успокоява чувствителна и раздразнена кожа, създаден за европейката, търсеща ефективен мултифункционален крем, справящ се с макс. проблеми- мултифункционален дневен- нощен. При нанасяне съм забелязала ефект, който постигам с базите за грим- омекотява чертите, ефект на отпочинала кожа и свежа. Обезмаслена формула, но е подходящ за всеки тип кожа, добре пази от студа и вятъра през зимата- формулата е създадена специално да пази от резките температурно изменения, а лятото- да не омазнява излишно.За освежаване бих ти препоръчала и от утлра-премиум линията ReNutriv - Replenishing Comfort. От всички Ре-нутрив този е с най-слабото антиейдж действие (и най-евтиния от всички)- хидратира отлично, няма белене на кожата, няма запушени пори, пази от признаци на стареене, справя се начални такива. Текстурата е предназначена за ном./ суха кожа, но аз съм с комб. /мазна и ми идва ок, дори лека. Особеното при този крем и че озарява лицето със сияен воал, дискретно- придава ефекта, който придават герленските метеорити. Придава лек розово-перлен отблясък на лицето. От разстояние лицето е оптически много свежо, сияйно, но не мазно, с равномерен тен. РеНутрив кремът е 3 в едно- дневен, нощен и серум в едно.",5.0
"О, Splendora, обичам да те чета  Много ти благодаря за насоките Аз съм ползвала Ренутрив кремът, но преди време - сега реших, че вече не ми е достатъчно анти-ейдж , но ефектът му е точно както го описваш, а текстурата....  И аз съм с комбинирана кожа. Бях си взела мостра на Daywear , но ми идва тежък и ми мазнее...Т-зоната ми се омазнява още по-бързо Задължително ще пробвам Revitilizing Supreme. А СС крема от тази серия пробвала ли си?Тествала ли си крем или околоочен такъв от серията Resilience lift? И не помня от предната тема - доволна ли си от някой от серумите на ЕЛ/предвид сходния тип кожа, ми е интересно твоето мнение ",3.0
"И аз съм много доволна от Revitilizing Supreme, бях го хвалила дълго и напоително нейде из темите Названието глобален крем, което е така модерно сред козметичните компании напоследък, ми е леко смешно, но е факт че си изпълнява всички обещания поне при мен. А текстурата е просто мечта",5.0
"Това при мен е последният крем, който купих без проба, по хвалби - огромна грешка. За смесената ми кожа дойде ужасно тежък, мазен, разшири ми порите, съсипваше ми грима и т.н. Не оплювам крема, казвам само, че пробите са много важни.  Сплендора също го е казала.",1.0
"Разбира се, че си трябва тест и че всяка кожа е различна.Много пъти сме обсъждали, че форумът трябва да се чете крайно избирателно Аз например знам вече с кои потребителки имаме сходни кожи/коси/вкусове и имам предвид техните мнения.",0.0
"И аз съм така  Различни потребителки в различни отношения и теми ПС: кремът ми го препоръча консултантка на Ести, не някоя съфорумка...",0.0
А тестер нямаше ли?,0.0
"Може и да е имало, акъл и опит не ми достигна. За тестер винаги има един отворен крем, който за мен е напълно излишен - какво ми носи да си го намажа на ръката?! Кожата там е съвсем различна. Тестер - задължително за вкъщи",0.0
"Трябва и аз да си набележа няколко такива.  Последният ми крем се оказа много неподходящ за мен и сега се чудя какво да го правя.Мисля сега да поръчам червилата някое и май ще е Potent, нали било най-купувано от българките.  Еми, този нюанс на компютъра най-много ми допада. Също мисля и за Insatiable Ivory, Desirable ili Intense Nude.",0.0
"Не е вярно! Не купувай това червило без да си го пробвала на устни. Цялата тази колекция червила е великолепна и единственото червило, което се различава по консистенция и нанасяне е именно Потент. Половин форум го купи и писаха мацки тъкмо това. Става на парцали, не се нанася като масло и цвета е доста по-блед и ненаситен от другите червила от серията. Имаше го доста в размените. Аз имам розовото Powerful и е великолепно, маже се като масло и ми държи по цял ден. Тъкмо да купя Потента, защото е хубав цвят и започнаха лошите отзиви. Пробвах го няколко пъти внимателно и бяха прави момичетата. Отпадна веднага разбира се!",3.0
